source,title,authors,year,venue,doi,pmid,pmcid,arxiv_id,semantic_scholar_id,url,abstract,search_query,search_topic,retrieved_at,raw_file,initial_relevance,status,notes
Semantic Scholar,Neural Population Dynamics during Reaching Are Better Explained by a Dynamical System than Representational Tuning,unclear_from_review,2016,PLoS Comput. Biol.,10.1371/journal.pcbi.1005175,27814352,5096671,,af1a65fa44773c427235e1f88bf714d64418883f,https://doi.org/10.1371/journal.pcbi.1005175,not_included_title_level_only,from_search_run_001,pop_dynamics,2026-07-01,unclear_from_review,high,candidate_title_level,"representative experimental landmark；population dynamics / neural manifolds；需要人工确认任务、物种、记录尺度和 figure-level evidence。"
Semantic Scholar,Preserved neural dynamics across animals performing similar behaviour,unclear_from_review,2023,Nature,10.1038/s41586-023-06714-0,37938772,10665198,,6c2952e1d99761ae5bc40558905b37875e87a8ab,https://doi.org/10.1038/s41586-023-06714-0,not_included_title_level_only,from_search_run_001,pop_dynamics,2026-07-01,unclear_from_review,high,candidate_title_level,representative experimental landmark；跨动物 neural dynamics；需要确认是否适合作为 field-level anchor。
Semantic Scholar,Brain-wide dynamics linking sensation to action during decision-making,unclear_from_review,2024,Nature,10.1038/s41586-024-07908-w,39261727,11499283,,edb148e6ccc32491a80ff81bc6918258bd6a4d7d,https://doi.org/10.1038/s41586-024-07908-w,not_included_title_level_only,from_search_run_001,pop_dynamics,2026-07-01,unclear_from_review,high,candidate_title_level,representative experimental landmark；brain-wide / distributed computation；需检查是否与其他 decision-making multi-area papers 概念重叠。
Semantic Scholar,Brain-wide resting-state fMRI network dynamics elicited by activation of single thalamic input,unclear_from_review,2025,Nature Communications,10.1038/s41467-025-66104-0,41408036,12717177,,1030c1b0db3a8a43b8aaee3fd215340359075bc2,https://doi.org/10.1038/s41467-025-66104-0,not_included_title_level_only,from_search_run_001,brain_wide,2026-07-01,unclear_from_review,high,candidate_title_level,representative experimental landmark；brain-wide dynamics 加 single thalamic input activation；具备 causal perturbation angle。
Semantic Scholar,Large-scale high-density brain-wide neural recording in nonhuman primates,unclear_from_review,2025,Nature Neuroscience,10.1038/s41593-025-01976-5,40551025,12229894,,ab37a484708b1832dff24b520120bd8a0e2e64a5,https://doi.org/10.1038/s41593-025-01976-5,not_included_title_level_only,from_search_run_001,brain_wide,2026-07-01,unclear_from_review,high,candidate_title_level,representative experimental landmark / method；brain-wide recording scale；需确认是否包含 computation-level results。
Semantic Scholar,Long-range projections coordinate distributed brain-wide neural activity with a specific spatiotemporal profile,unclear_from_review,2016,PNAS,10.1073/pnas.1616361113,27930323,,,027f3fff0947191976d13bb1ba2a7e95cd8d820e,https://doi.org/10.1073/pnas.1616361113,not_included_title_level_only,from_search_run_001,brain_wide,2026-07-01,unclear_from_review,high,candidate_title_level,representative experimental landmark；multi-area communication and routing；需要检查实验系统、投射通路和 causal status。
Semantic Scholar,Human brain state dynamics are highly reproducible and associated with neural and behavioral features,unclear_from_review,2024,PLoS Biology,10.1371/journal.pbio.3002808,39316635,11421804,,8f7f30f53bdbbea2a78c81541e35df7ddbdb361d,https://doi.org/10.1371/journal.pbio.3002808,not_included_title_level_only,from_search_run_001,brain_wide,2026-07-01,unclear_from_review,high,candidate_title_level,representative experimental paper；human brain state dynamics 与 behavior；需要确认 state 类型与行为解释力度。
Semantic Scholar,Inferring stochastic low-rank recurrent neural networks from neural data,unclear_from_review,2024,Neural Information Processing Systems,10.48550/arXiv.2406.16749,,,2406.16749,579f56813a03517163b86fa89044dc78505bf2cb,https://doi.org/10.48550/arXiv.2406.16749,not_included_title_level_only,from_search_run_001,pop_dynamics,2026-07-01,unclear_from_review,high,candidate_title_level,theoretical / computational method；model-based inference from neural data；需要确认 method paper、benchmark data 和 survey 方法轴价值。
